,CommentText,Nickname,Date,LikesCount,IsBaseComment
0, Все в .. ЕС , Juchar Juchara ,2022-02-17 02:12:00,70,True
1, Давно пора жёстче разбираться с этой публикой. , Один в поле воин кто по русски скроен! ,2022-02-17 02:15:00,155,True
2, поздно уже , Михаил Б ,2022-02-17 02:20:00,106,True
3," Хорошо. Но не меньше, а думаю даже больше нужно следить и жёстко пороть тех, кто на таможнях и не только берут взятки способствуя проходу этого потока. Наказанием вплоть до пожизненного ", Андерсен Г. ,2022-02-17 02:21:00,183,True
4, Богу в уши! , Елена Лек ,2022-02-17 02:23:00,58,True
5, Наконец-то.. , Вячеслав Г. ,2022-02-17 02:24:00,79,True
6, Ассоциацою Плодо-Овощных Рынков Москвы и Петербурга надо пошерстить в первую очередь! , Arik A. ,2022-02-17 02:25:00,119,True
7," Они все окажутся легальными ""собянинскими строителями"" ", Петя Грин ,2022-02-17 02:28:00,133,True
8, Неужели дал добро? Наконец-то! , Miya Smely ,2022-02-17 02:30:00,99,True
9," Догадайтесь с одной попытки , в какой стране топовые призывльщики , возмущальщики , нота протестники у власти . ", Никола Шарроукин ,2022-02-17 02:31:00,85,True
10, Когда толпа у нашей школы расстилает свои коврики мне НЕТ разницы легальные ли это мигранты или нет! , Петя Грин ,2022-02-17 02:32:00,1401,True
11," Эта глупая страна никак не поймёт, не мигранты работают на нас. А мы, работаем для них. ", Максим Рянзин ,2022-02-17 02:33:00,205,True
12," Если всех этих ""мигрантов"" выслать, то вам только спасибо скажут. ", Механик Ъ ,2022-02-17 02:36:00,881,True
13," Господи, неужели это свершилось. Только бы наши ""исполнители"" не замотали этот в своих кабинетах. ", Voblikov65 ,2022-02-17 02:38:00,170,True
14, Всех что ли высылать приказал? , Виктор Гармашов ,2022-02-17 02:38:00,80,True
15, Может пора уже вводить визовый режим с южными соседями? , Радари Чиполлино ,2022-02-17 02:39:00,102,True
16," Отлично. А до этого нелегальные мигранты были как-бы немного ""легальны"", да? ", Константин Русский ,2022-02-17 02:46:00,71,True
17," Зачем сразу высылать? Пускай отработают, но уже в ином статусе. ", sir expeditus ,2022-02-17 02:49:00,47,True
18, За экстремизм ? Разве они ходят с плакатами -Долой коррупцию ? , Ник Изобретатель ,2022-02-17 02:50:00,69,True
19, Неужели что то годное сказал сделать ? Давным давно это надо было сделать ! , Генадий Букин ,2022-02-17 02:50:00,58,True
20," И высылать их надо всех кто торгует на рынках!!! Толку от торгашей, не платящих ни каких налогов! Физический труд только!! ", ALEX 23 ,2022-02-17 02:51:00,92,True
21," Нет , не свершилось , это не указ , и не приказ , это просто призыв, а призывы никто не выполняет , так как это не обязывает ничему. ", Ник Изобретатель ,2022-02-17 02:51:00,98,False
22," Чеченцы, пока-пока? ", Alex Dee ,2022-02-17 02:55:00,66,True
23, Насчет нелегальных понятно. А легальным разве можно? , Сергей Васильев ,2022-02-17 02:56:00,56,True
24, Надо сначала выслать всех... ввести визовый режим и запрет на вьезд семьями...кишлаками и аулами..)) , pks-8991 ,2022-02-17 02:56:00,118,True
25, Главное выселять все их семьи и лишать гражданства! , RUS VOLK ,2022-02-17 02:59:00,113,True
26," Значит ли выражение ""высылать за любые правонарушения"" то, что если мигрант перейдёт улицу на красный свет, то его задержат и он поедет домой? Это было бы неплохо. Пусть сидят тише воды и ниже травы. А, хулиганов нам не надо - мы сами хулиганы(с))). ", Максим Викторов ,2022-02-17 03:02:00,57,True
27," Поздно спохватились, у них здесь уже прописки и вид на жительство… ", Ira Martini ,2022-02-17 03:03:00,86,True
28, так они тебя и послушали) , Кверти Уиоп ,2022-02-17 03:06:00,29,True
29," А может изначально не надо было позволять господам олигархам ввоз дешевой рабсилы, да еще большей частью нелегально? ", arhipov1356 ,2022-02-17 03:07:00,70,True
30," Тех,кто проявляет экстремизм ,нарушает российские законы и за незаконную трудовую деятельность,только их! ", Теодор Осипов ,2022-02-17 03:08:00,28,False
31," свершилось? вы видели что хоть что нибудь сработало из сказанного и принятого? хоть что нибудь предвосхетило ожидания и заработало лучше чем хотелось? Россию поглотила восточная чума, они будут делать что захотят их будут прикрывать криминальные диаспоры затыкая продажной власти рот деньгами из общаков. точка. ", скрепы наши ,2022-02-17 03:14:00,75,True
32," Вовремя приняли законы, а то сейчас с Украины как побегут. ", Алексей ,2022-02-17 03:15:00,30,True
33, Теперь им с утроенной энергией начнут выдавать паспорта РФ. Чтобы выгнать стало совсем невозможно , Артур Скабичевский ,2022-02-17 03:16:00,58,True
34," Бесполезно все это, потому что вся власть коррумпирована. На каждой остановке объявление - Гражданство 1500р, вид на жительство 1000р. За копейки продают страну. Ну вышлют их, через два месяца назад приедут, заплатят кому надо. У нас законы не работают. ", Ольга Старовойт ,2022-02-17 03:21:00,87,True
35," Очнулся через 20 лет, ну хоть так чем никак. ", Руслан ,2022-02-17 03:21:00,59,True
36, За гроши мигранты не работают.Не пробывали пригласить на 6 соток грядки выкопать?Меньше 5000 т.р в день никто не пойдет.Грубая раб сила сейчас дорого стоит. , olg5555 ,2022-02-17 03:22:00,48,True
37, Отличное решение!!!!!!!! Дождались наконец то!!!!!!! , Игорь Иванов ,2022-02-17 03:23:00,38,True
38, да они только и молятся за Путина.... , иван иванов ,2022-02-17 03:24:00,28,True
39, Ты будешь мне еду носить и мой офис мыть? ," Дядюшка Джо смотрит в окно, хочет понять, почему так темно ",2022-02-17 03:29:00,60,False
40, Так не надо их сюда приглашать и давать гражданство! Причем здесь МВД? Надо давать работу прежде всего для граждан своей страны и давать достойную зарплату! В нашей стране основной инициатор такой миграционной политики Президент и никто иной! , Адель Адель ,2022-02-17 03:31:00,52,True
41, Легальные мигранты тоже совершают преступления , Сергей Лаврушкинов ,2022-02-17 03:38:00,55,True
42," У нас вся Россия нищая, а Президент приглашает еще мигрантов и дает им гражданство, а кто своим будет давать работу? ", Адель Адель ,2022-02-17 03:39:00,67,True
43, В смысле высылать? А отвечать по закону жертва будет? , Василий Пешненко ,2022-02-17 03:40:00,27,True
44, Ураааааа!!!!! , Рагнар Русский ,2022-02-17 03:42:00,20,True
45, Наконец то перестанут у Русских работу отнимать и занижать оплату труда !!!! , Рагнар Русский ,2022-02-17 03:43:00,44,True
46," И что, он за пятерых работать будет? ", Старый Ворчун ,2022-02-17 03:48:00,24,True
47, Чеченцы - это россияне. Не путайте с мигрантами-иностранцами. , Arik A. ,2022-02-17 03:50:00,40,False
48," Я правильно понял, что в стране законодательно всё давно готово, но президенту нужно периодически понукать исполнительные органы? Без окрика, простите, призыва президента не решаются ни социальные, ни медицинские, ни экономические проблемы. Правильно страну колоссом на глиняных ногах называли. ", Pinter Wafloo ,2022-02-17 03:50:00,22,True
49," Чечня, это Россия. Так же и про вас можно сказать, когда вы приедете в любую республику, край или область России. ", Savva Panf ,2022-02-17 03:56:00,34,False
50, Очередной трёп , Игорь Андреев ,2022-02-17 03:59:00,60,True
51," Они стали не нужны! Ну, и начали борзеть! ", Юрий Шереметьев ,2022-02-17 03:59:00,27,True
52," Просто в восторге. Мы сами вешаем объявление о гражданстве, виде на жительство, сдаём им квартиры , потакаем их наглости и хамству, а виноваты мифические коррупционеры. А высылать надо не только нелегальных но и легальных, которые по -русски не бельмеса, а наглости , хамства, презрения по отношению к нам через край. Они нам спасибо за предлоставление работы никогда не скажут, на нас наживаются и считают глупцами. ", Лавр Студёный ,2022-02-17 04:03:00,79,True
53," Высылать сразу весь род нарушителя , вместе с женами и детьми. ", Александр Шевалье ,2022-02-17 04:05:00,65,True
54," А каким образом нелегальные мигранты в Россию попадают? У нас суверенное государство или проходной двор? И что—нелегальных мигрантов будут высылать только за экстремизм? Вместо того, чтобы всех поганой метлой выкинуть из страны! ", Александр Савин ,2022-02-17 04:09:00,59,True
55, Россия собирается усиливать пограничников с севера и с юга одинаково? , Aleksandr FromNR ,2022-02-17 04:10:00,8,True
56, А китайцы?.. , Bazilius Che ,2022-02-17 04:12:00,14,True
57," Наш,,,всенародно избранный"""",эту тему не первый раз муссирует,а воз и ныне там.Впрочем,не припоминают.что он вообще выполнил из своих обещаний. ", Сергей Чафин ,2022-02-17 04:13:00,39,True
58," Можно подумать, что правонарушения совершают только нелегалы. Легальные тоже отрываются по полной, потому что им ничего кроме высылки не грозит. Почему к ним не применяют УЗК, ведь любой иностранец должен отвечать по заслугам, так же как и граждане. ", Пузан Пузаныч ,2022-02-17 04:15:00,39,True
59," В первую очередь надо усилить контроль мигрантов на вьезде в РФ, А не искать, их потом на бескрайних просторах, необходимо в ведения визового режима ! ", Влад Шкапин ,2022-02-17 04:16:00,38,True
60," Ну вышлите мигрантов , а кто работать будет , россиянин . Россиянин с раннего утра , и до позднего вечера на машине гоняет оглушая окружающих своей идиотской музыкой . В грязи заростем ... ", Владислав ALIMOV ,2022-02-17 04:16:00,59,True
61," Ситуация преднамеренно создана и сильно запущена, однако, если принимать разумные меры, ее можно постепенно исправить. Нужно вводить визовый режим со всеми ""друзьями"", проверить всех, кто получил российское гражданство за последние 20 лет, трудовые визы давать на время и только специалистам. Мер нужно принимать много и разных, однако, те, кто приглашает дешевую рабочую силу, будут противодействовать. Если президент сказал, это еще не значит, что будет выполнено. ", ls macdel ,2022-02-17 04:19:00,40,False
62," Да, но не только нелегальные ведут подрывную деятельность в России... ", Юрий Марцун ,2022-02-17 04:19:00,29,True
63," Проблема в том , что наши предприниматели озабочены не развитием страны, а личным обогащением, не понимаячто , если ют и они. обнищает страна обнищают и они. Нафиг нам эти мигранты, установите нормальную плату за работу и не нужны будут мигранты. В Китае никто не зовёт мигрантов, нормально платят и сами работают. Это в ЕС прибалты используются как мигранты у нас, а мы то что им подражаем, неужели до сих пор не ясно, что мы не ЕС и жить нам надо своим умом. ", Лавр Студёный ,2022-02-17 04:19:00,35,True
64," А легальные мигранты могут убивать, насиловать и кошмарить, так как у них есть крыша, которая их отмажет, правильно? ", izv2003 ,2022-02-17 04:20:00,34,True
65," все верно, особенно сейчас, когда ситуация в некоторых регионах с ними дошла до предела, а нелегалам я бы вообще въезд в страну запретил повторный, думаю Медведев с Бастрыкиным сейчас разберутся, что делать с ними ", Владимир Аксёнов ,2022-02-17 04:22:00,16,True
66," Вообще в школу ходят люди затем, чтобы получать ЗНАНИЯ! Если интересуют религиозные знания - это в других учебных заведениях преподают. ", Андрей Михайлов ,2022-02-17 04:22:00,30,True
67," А против тех, кто завозит их- не призвал? Или МВФ приказало заменить русские народы? ", Галина Шишкина ( Кривоногова) ,2022-02-17 04:23:00,39,True
68," Смешно всё это сколько лет уже прошло об этом не говорили а теперь заговорили. Так их здесь уже миллионы в России и у всех регистрация имеется выданная государственными чиновниками. Дети ихнее в школу ходят и детские сады забиты ими. Раньше нужно было думать об этом а не эшелонами сюда везти рабочую дешёвую силу, на этом чиновники миллионерами становились тихо молча втихаря. Они сами создавали в стране чистейшию безработицу. Сейчас они живут в каждом доме в каждом подъезде имеются, на улицу выходишь направо-налево посмотришь везде одни ихние лица стоят. В такси работает 80% приезжих про стройки говорить нечего они забиты ими также и магазины все и т.д.. К этому относится также сельская жизнь, первый мэр в Калуге начал от них избавляться теперь здесь это подхватили и одумались что они натворили и что со страной сделали. ", Дмитрий Лавренцов ,2022-02-17 04:23:00,51,True
69," Обидно только что это всего лишь призыв, а не указ , или приказ , или подписанный закон. ", Sarcasm Trollingov ,2022-02-17 04:23:00,37,True
70," Не поймём , во что превращем страну , плохо кончим. Пора думать о стране, какой мы её сотворим , так и жить будем и никакие мигранты нам в этом не помогут, они не дураки. ", Лавр Студёный ,2022-02-17 04:26:00,23,True
71," Правильно! Отселить лжедипломатов америки, англии, украины... ", денис кулагин ,2022-02-17 04:27:00,10,True
72," Об этом нужно надеяться и мечтать. Хоть нынешняя молодежь спокойно на работу устроиться. Сейчас в данный момент больше 45 лет на работу не принимают работать по трудовой, простой ответ у них нужны помоложе. ", Дмитрий Лавренцов ,2022-02-17 04:27:00,24,False
73," Ага. А потом через полгода примут очередное решение об ""амнистии""... ", Alex ,2022-02-17 04:27:00,30,True
74, Амнистию протащит... , Alex ,2022-02-17 04:28:00,18,True
75," Всё сам, а то ишь, барин нашёлся ", Пескарь Премудрый ,2022-02-17 04:32:00,28,False
76," И только на третий день Зоркий Сокол заметил, что в сарае нет одной стены... ", Сам себя боюсь ,2022-02-17 04:43:00,39,True
77, Гражданства можно и лишить ! , Влад Шкапин ,2022-02-17 04:44:00,31,True
78," Можно было бы ещё пару раз в месяц проводить рейды по отлову нелегалов. Тем самым в короткие сроки освободить от потенциальных преступников крупные, областные центры. Про Москву и Питер даже говорить нечего. Там рейды можно через день проводить и улов всегда будет. ", Тамара Ощепкова ,2022-02-17 04:45:00,1290,True
79," В школах, больницах и др. общественных заведениях не должно быть никаких молельных. ", mikh.ol ,2022-02-17 04:47:00,47,True
80," Предлогаю статью УК,за публичные высказывания о не умении и не желании русских работать,с реальными сроками. ", Сергей Чафин ,2022-02-17 04:51:00,41,True
81," Батюшки! Что же это творится, давнюю угрозу почуяли. ", Панорам Горизонтович ,2022-02-17 04:56:00,13,True
82, Вот это правильно... , сергей сергей ,2022-02-17 05:00:00,12,True
83," А ничё что казахи в казаках ходят , нормально это ? Сам лично видел в Омске ""казачий рынок "" охраняли ", Вася Васильев ,2022-02-17 05:01:00,14,True
84," Мне конечно мигранты ничего плохого не сделали, но открыли рядом с моей нелегальную шаурмичку, тем самым стали мне конкурентами. Я плачу налоги, они нет. Всех клиентов незаконно переманили. ", Алексей Шаров ,2022-02-17 05:02:00,22,True
85," Их диаспоры давно в системе и вот так высылать не дадут,занесут кому надо и всё будет у них хорошо. ", Александр Б. ,2022-02-17 05:04:00,36,True
86, Или паспорта дадут. , Oleg Oleg ,2022-02-17 05:08:00,11,False
87," Уже давно ,почти сравнялись з/п. И вдобавок эти ,как называете -гроши,у них превращаются в очень немалые деньги по приезду к себе. Они хвастаются,показывая какие себе,там дома строят и рассказывают,что там они миллионеры.Не скажу ,что все подряд,но большинству,эти ""гроши"" помогают очень неплохо жить там. А вдобавок ,их + к криминалу здесь. Присваивания квартир россиян,разными способами и т.п. . ", m-pote ,2022-02-17 05:11:00,30,True
88," Давно пора. Приехали работать пусть работают, никто им не запрещает, но когда наглеют, совершают преступления, какую то территорию объявляют своей, пошли вон. ", Алексей Герасименко ,2022-02-17 05:11:00,30,True
89," Это точно. А то и депортируют за счет нашего государства,не предъявляя счета государству приезжего. ", m-pote ,2022-02-17 05:13:00,15,False
90," Если мигрант нелегальный, то высылать нужно и без всяких подозрений в экстремизме. Если легальный, тогда да, дополнительный повод нужен. И сажать тех, кто их сюда завозит. ", Konstantin Kolbasin ,2022-02-17 05:14:00,27,True
91," Да уж ,Медведев разберётся))) ", Александр Безфамильный ,2022-02-17 05:15:00,15,False
92, Точно процитировали? А то Песков опять про нюансы расскажет , Фат Туа ,2022-02-17 05:16:00,10,True
