,CommentText,Nickname,Date,LikesCount,IsBaseComment
93, Конечно же за наш. В этом году в Таджикистане построят 5 школ с изучением предметов на русском языке. Наше правительство выделило 150 миллионов долларов для подготовки бушующих мигрантов. В миллиарды рублей переведите сами. , Плавали знаем Плавали знаем ,2022-02-17 05:18:00,16,True
94," Да, правильно Владимир Владимирович! Давайте высылать мигрантов, которые выходят протестовать против скотских условий, систематических не выплат з\п зажравшимися воротилами бизнеса, а вот тех кто под шумок воруют у местного населения, обманывают, грабят, насилуют и сидят не отсвечивают перед работодателем за подачки и готовые жить в натуральных свинарниках и будках, вот они капиталистам нужны, они нас устраивают. Национальный лидер - моё почтение. ", Viktor Rotkiv ,2022-02-17 05:19:00,23,True
95, И как это кто то будет этим заниматься? , Виктор Гармашов ,2022-02-17 05:20:00,3,False
96," А они ,хотят?!!!!.. Уже не один год,пытаемся увидеть дворников(и знаем ,что наняты гастарбайтеры) метущих дворы ,убирающих снег.Вовремя и чисто убранные подъезды,с вымытыми окнами наших домов. А вот разъезжающих их на велосипедах и с тележками,собирающих ,складирующих вторсырье и грузящих потом его на а/в для вывоза и сдачи для собственного кармана. Оформлены не на одну единицу,а не выполняющих даже за одну. ", m-pote ,2022-02-17 05:21:00,19,True
97," Russian People явно нелегал, раз так рассуждает ", Pticevod Pticevodov ,2022-02-17 05:23:00,2,True
98," А там давно торгашей нет,одни барыги в основном. Тем более ,что и из наших подобных барыг.тоже хватает. ", m-pote ,2022-02-17 05:23:00,4,False
99," Бросили ребенка на олимпиаде. Теперь хоть СССР возвращайте - на выборы 24 не иду, пошли вы все. ", Майя Савина ,2022-02-17 05:24:00,25,True
100," Изначально их нужно принимать только на условиях отказа от радикальных убеждений. Потому что они не признают равные права для ЖЕНЩИН, считают их своими рабынями, и несут угрозу и порабощение для наших ЖЕНЩИН. Я работал на востоке, видел, что они с Девушками делают во имя веры ", Andrey Voronin ,2022-02-17 05:25:00,20,True
101," Сегодня вышлют, а завтра амнистия! ", a22031974 ,2022-02-17 05:27:00,21,True
102," там уже успелось легализоваться несколько миллионов. а как быть с легальными мигрантами, которые нарушают закон и живут в общинах по законам аула? на совете дружины пионеров , которых давно нет пристыдить ? ", С 500 ,2022-02-17 05:38:00,18,True
103, Ура. Пора уже высылать и квоту уменьшать. Ведут себя нагло. Неприлично нагло. Нельзя создавать хоть на клочке земли в России где должны жить лишь по их правилам. Главное чтобы на задний ход не дал. , Виталий Г ,2022-02-17 05:38:00,21,True
104, Запретить ввозить свои семьи! , RUS VOLK ,2022-02-17 05:38:00,26,True
105," Своих за ""экстремизм"", причём за любую ерунду - сажают от 5 до бесконечности, а этих типо просто высылать? С - справедливость :/ ", Sergey Ivanov ,2022-02-17 05:41:00,17,True
106, Ведь сами позволяем компаниям нанимать их. Тот же ЖКХ. Из за них даже на пол ставки (что то вроде 2×2) курьером или дворником не наймёшся. , Виталий Г ,2022-02-17 05:43:00,27,False
107, Что-то акцент в основном на нелегальных мигрантов. А легальным можно законы нарушать? Вообще надо при въезде обязательно отпечатки пальцев брать. , Александр Иванов ,2022-02-17 05:44:00,28,True
108," Проснулся любитель ""братских народов""!!! ", Sergey Muravlev ,2022-02-17 05:45:00,28,True
109," не на тот митинг пришел, противный ", sentor well ,2022-02-17 05:46:00,12,False
110, как быть уже с получившими гражданство и своими же гражданами закавказья с вызывающим и агрессивным поведением? , С 500 ,2022-02-17 05:50:00,21,True
111, Скорее ещё одна строка дохода у полицаев нарисуется. , Андрей Алексеев ,2022-02-17 05:51:00,19,True
112, Ловишь даёшь предписание с датой выезда. Вбиваешь в компьютер. Если поймали даже на таможне с просроченым предписанием в тюрму отправляешь лес валить на еду и проезд обратно зарабатывать. , Виталий Г ,2022-02-17 05:51:00,20,True
113, Да уж беда с нашей доброй политикой. , Виталий Г ,2022-02-17 05:52:00,14,False
114," Отстаньте от дедушки,ему уже можно забывать. ", Андрей Алексеев ,2022-02-17 05:52:00,14,True
115, Не живут по закону России. В полицию заявление. Если не принимают меры то письмо президенту и остальным вышестоящим. , Виталий Г ,2022-02-17 05:54:00,20,False
116," статью неистовою плюсую, но нужны огораживающие методы против детей высотных широт от некультурного поведения. надо требовать от старейшин их замляков, что бы воспитывали. ", С 500 ,2022-02-17 05:55:00,16,True
117, давно пора !!!!!!!!!!!!!!!!!!!! , wiking7000 ,2022-02-17 05:57:00,18,True
118," Правильно ли я понял, что нелегальных иммигрантов-экстремистов (то есть нарушивших закон вдвойне) - будут просто выдворять, в то время как своих граждан, по 282 статье никуда не выдворяют, а часто отправляют в места не столь отдаленные? И это при том, что для иммигрантов проводят регулярные массовые амнистии, позволяющие им снова приезжать в Россию.. Очень справедливо, господин Путин.. ", Евгений Визбеков ,2022-02-17 06:09:00,28,True
119," я надеюсь он сказал не то что имел ввиду, он же огромный класс народа подписал под высылку, ""незаконная трудовая деятельность"", так смотря что подразумевать, можно каждого второго подписать ", Rondondon Ratatata ,2022-02-17 06:20:00,16,True
120, Сам пятую точку поднимегь с дивана и сделаешь , Галина Галина ,2022-02-17 06:24:00,21,False
121, их для этого и свозят. Хуснулин не даст соврать. , С 500 ,2022-02-17 06:24:00,21,True
122, Вы серьёзно?! Это же наивно. Созжание ограничительных мер способствут созданию анклавов. Жить по закону надо. Старейшины не воспитают. Уверяю. , Виталий Г ,2022-02-17 06:25:00,10,False
123, Нужно губернаторам и мерам повести себя как в калужской области. , Виталий Г ,2022-02-17 06:29:00,23,True
124, вы в курсе на зонах их очень много и начинают выдавливать там наших местных бугорков. есть целые мусульманские зоны со своими законами. , С 500 ,2022-02-17 06:29:00,15,True
125, Дизлайки всем мигранты ставят скрипя зубами )))) , Русский Человек ,2022-02-17 06:29:00,23,True
126," Так если из них кто то чуть выше должность берет , то все, только своих. По шерсти ))) ", Русский Человек ,2022-02-17 06:34:00,15,False
127," Да всё одной говорильней опять и закончится не успев начаться. Чтобы понять это, достаточно сходить на улицу. ", Денис Хорошев ,2022-02-17 06:35:00,25,True
128, Ты наверное забыл что кроме армян и Таджикистан и Киргизия и Казахстан тоже партнёры по ОДКБ к нелегалам это не должно относится армянин ты или папуас закон один для всех. , Лариса Смирнова ,2022-02-17 06:36:00,7,True
129, верно. без идеологии это массовое оружие. в СССР эти же выходцы были более менее спокойные. идеология пропала и они стали обратно первобытными. каждый второй боец UFC Типа , С 500 ,2022-02-17 06:38:00,15,False
130," оно сделает все наоборот, запретил, значит разрешил! Вспомните ситуацию с продуктами первой необходимости, с тем же растительным маслом и сахаром)))))) ", НИК БИМ ,2022-02-17 06:42:00,17,True
131," Как мигранты- в ЕС, как бабки делить- это моё. Хорошо устроились ", Кентавр Стрелец ,2022-02-17 06:43:00,7,False
132," Все ""новостройки"" что рядом с Москвой, и находятся за МКАД (города-Спутники), заселяют приезжие, цена недвижимости дешевле, и доступнее... Там и ищите ""нелегалов"", многие работают за МКАДом ", Дмитрий Бобылев ,2022-02-17 06:45:00,13,True
133," Ищите нелегалов за МКАДом, они теперь там квартиры скупают, города - Спутники ", Дмитрий Бобылев ,2022-02-17 06:46:00,10,True
134," Насмешил. Похоже, у него правая рука не знает, что делает левая. ", Вера Карпавичене ,2022-02-17 06:48:00,15,True
135," В первую очередь приостановить ""программу переселения соотечественников"", а именно татжиков, узбеков, киргизов, армян, азербайджанцев. ", Пётр Манджиев ,2022-02-17 06:49:00,29,True
136," Они сейчас живут за МКАДом, скупают дешевые квартиры, там же и работают, рядом с Москвой ", Дмитрий Бобылев ,2022-02-17 06:51:00,7,True
137," Правильно, как однажды мой соотечественник спросил,почему он не может открыть чебуречную ,а мигранты вон сколько кафе открыли и магазинов.Потому что, сказал другой мой коллега, пока ты справки собираешь и они выходят по нормативным срокам ,мигранты в конверте кому надо суммы кругленькие несут.Вот и различие. ", olg5555 ,2022-02-17 06:54:00,19,False
138, Пенсионерка с пенсией в 12 тысяч с радость устроится.но тебе же нужны мигранты и налоги не платить . , Александр Вергунов ,2022-02-17 06:55:00,21,False
139," ""Тридцать первого ЯНВАРЯ 2021 года перестали действовать введенные президентом временные меры, позволявшие иностранцам урегулировать свой правовой статус. С 1 ЯНВАРЯ ЭТОГО ГОДА нелегальных трудовых мигрантов могут не только оштрафовать до пяти тысяч рублей, но и выдворить из России..."" Тут, похоже, декабрь 2021 года с январём 2021 перепутали... ", Ослик Иа-Иа ,2022-02-17 06:58:00,5,True
140," Все ""нелегалы"" уже рабротают за МКАДом, там же скупают жильё, в городах ""Спутниках"", где цены дешевле.... В Москве их нет, только за МКАДом ", Дмитрий Бобылев ,2022-02-17 06:58:00,11,True
141," Давно бы надо это делать, да вот только будут ли? ", Младший прапорщик ,2022-02-17 07:00:00,9,True
142, Наша власть удивляеться почему сокращаеться население. Кто то уезжает потому что не хотят на это смотреть. Кто то от нервов умирает. А кто то боиться рожать в этой ситуации. Понемногу и ком собираеться. , Виталий Г ,2022-02-17 07:03:00,23,True
143, Попахивает неуважением к чужой религии. Вам бы в Махачкалу/Грозный/... посетить. , Ослик Иа-Иа ,2022-02-17 07:05:00,36,False
144," Если товарищей мигрантов, что-то не устраивает, то они всегда могут сменить страну пребывания и работодателей, их здесь насильно никто не удерживает ", Пескарь Премудрый ,2022-02-17 07:14:00,14,False
145," Школа не может отказать в приеме детей, если есть свободные места. Так в одной из школ Самары оказалось почти 70% детей эмигрантов. Недавно была избита второклассница тремя ребятами, отцы которых оказались нелегалами, из этого большинства. Был большой разбор, детей перевели в другое здание, в разные смены. Но девочке придется возвращаться в эту школу.Интересно - глава диаспоры именуется - ""Президент общественной организации «Региональная национально-культурная автономия таджиков Самарской области»!Не больше, не меньше – президент и автономии. Наш губернатор, наверное, и не знал, что с ним рядом такие люди! Или знал? ", efremovap ,2022-02-17 07:16:00,38,True
146," Надо прекратить ввозить мигрантов,ограничить долю прибыли , оставляемую предпринимателят, дерективно обязать предпринимателей заменить мигрантов нашими , принудитпредпринимателей выплачивать нормальные деньги. Пора заканчивать грабёж и жирование предпронимателей., пора работать на развитие страны , а не яхты, виллы, поездки по островам и т.д. и т.п. ", Лавр Студёный ,2022-02-17 07:17:00,30,True
147," Потому что в калужской области уже местные с мигрантами, стенка на стенку ходят, постоянно уличные бои в Обнинске. ", Пескарь Премудрый ,2022-02-17 07:21:00,26,False
148, за любое проявление значит только высылка?а поиграл в майнкрафт держи пять! , Секспир !!! ,2022-02-17 07:25:00,9,True
149, Вообще из России их гнать надо и без права въезда обратно... , Александр Безфамильный ,2022-02-17 07:26:00,27,False
150," Колличество наших рабочих мест сокращается из-за трудовых мигрантов, потому что наши люди не могут позволить себе работать на тех же условиях, на которых работаю трудовые мигранты, а трудовые мигранты могут, потому что стоимость жизни в странах из которых они приехали - ниже. ", Артём Макаров ,2022-02-17 07:28:00,22,True
151," Что вы к мигрантам пристали, хорошие люди, профессию освоили и мастера уже. ", Иванов Иван ,2022-02-17 07:29:00,34,True
152," А ничего, что у нас светское государство? Нечего из школ молельные места организовывать. Пусть в мечети или дома молятся. ", Пескарь Премудрый ,2022-02-17 07:33:00,41,False
153," Думаю, что главное не перегнуть палку, не гнаться за процентами, вопрос очень серьезный... ", Alex Grosh ,2022-02-17 07:44:00,15,True
154, Снова оговорки. Причин не нужно. Достаточно что нелегалные. , кажимеж мале ,2022-02-17 07:49:00,18,True
155," Нелегал очень выгоден нерадивым руководителям в администрации городов и полиции. Если есть работы по ЖКХ, то делали облавы. Был такой случай, к первомаю красили опоры ЛЭП на железной дороге без отключении напряжения и на одной из них рабочий зацепил провод, не упал и с него стала слетать горячая одежда, вечером бедолагу сняли. При отъездах домой, полицейские вычисляли их из потока машин, останавливали авто и вымогали деньги, такие же поборы были и на вокзалах ", Николай Александрович Гайдуков ,2022-02-17 07:51:00,14,True
156, Давно пора уже!!! , Elizaveta Ivanova ,2022-02-17 07:52:00,14,True
157," Когда случается пожар, гибнут люди, наказывают инспекторов пожнадзора, хозяев кинотеатров, кафе и т. д. А тут всё так просто, совершил преступление->выслали. Красота, и никого не наказали. Виновата жертва. ", Василий Пешненко ,2022-02-17 07:58:00,15,True
158, Смешно. , Виталий Г ,2022-02-17 08:01:00,9,False
159, Толку от этих заявлений. ИХ высылают а потом объявляют амнистию и так по кругу. , геннадий ,2022-02-17 08:04:00,17,True
160, Тут уже они перегнули палку. Тут уже метеором надо всех отправлять домой. В москве пьяные толпами ходят. И хотят что то изобразить только бояться как овцы все местные злые как волки. , Виталий Г ,2022-02-17 08:06:00,13,False
161, Может увольнять начальство у кого на територии найдут мигранта без права занимать высокую должность на пять лет. , Виталий Г ,2022-02-17 08:09:00,23,True
162, Кто за то чтобы губернаторы и мэры России вышли из системы переселения и ввели ограничения как в калужской области! , Виталий Г ,2022-02-17 08:12:00,27,True
163, ты бы еще место для обрезания предложил выделить , vadim365 ,2022-02-17 08:15:00,15,True
164," Нелегальный мигрант - это преступник! Хочешь приехать жить в другую страну - начни с уважения законов этой страны, касаемых миграции в эту страну! И надо запретить всякие диаспоры мигрантов! Это ни к чему хорошему не приведёт! Либо человек ассимилирует в новой стране, либо пусть живёт у себя на Родине! ", Иван Иванов ,2022-02-17 08:17:00,28,True
165," Поздно уже, половина получила гражданство РФ, и теперь они ещё больше королями стали. ", Сергей Кузьмин ,2022-02-17 08:21:00,28,True
166," начинать надо с тех которые уже получили гражданство, они самые наглые, плевали они на наши обычаи и законы, они теперь граждани РФ, они считают что теперь им все можно, развивают коррупцию, так и говорят что мы все купим, семья большая, денег хватит. ", Сергей Кузьмин ,2022-02-17 08:33:00,23,True
167, Ужесточить наказание за любое проявление нетерпимости со стороны приезжих с постсоветских государств по отношению к коренному населению регионов их пребывания. Больше двух:несанкционированный митинг! , Александр Клиновицкий ,2022-02-17 08:39:00,14,True
168," О, научился не только выражать озабоченность но и призывать. Еще лет десять и научится сразу указом такие вопросы регулировать. Или нет? ", DropBoxx3 ,2022-02-17 08:40:00,14,True
169," ...все это полумеры, вернее лишь намерения.....Нужно менять миграционное законодательство в корне....У России достаточно своих трудовых ресурсов. Пора прекратить потакать так называемому ""бизнесу"" и ужесточить условия о приеме на работу мигрантов. Всех поголовно отфильтровать и оставить лишь высококвалифицированных специалистов, причем не навсегда, а на определенный проверочный период. ", Vlad41g ,2022-02-17 08:40:00,20,True
170, Значит и судить и штрафовать их будут по нашим законам а не отправлять на родину. , Виталий Г ,2022-02-17 08:41:00,8,False
171, Есть те кто научит родину любить. , Виталий Г ,2022-02-17 08:43:00,7,False
